{
  "$schema": "http://json-schema.org/draft-07/schema#",
  "type": "object",
  "required": ["slug", "type", "path", "url", "repo", "icon", "i18n"],
  "additionalProperties": false,
  "properties": {
    "slug": { "type": "string", "pattern": "^[a-z0-9]+(-[a-z0-9]+)*$" },
    "type": { "enum": ["submodule", "external"] },
    "path": { "type": ["string", "null"], "pattern": "^/[a-z0-9-]+/$" },
    "url": { "type": ["string", "null"], "pattern": "^https://" },
    "repo": { "type": "string", "pattern": "^https://" },
    "icon": { "type": ["string", "null"] },
    "i18n": {
      "type": "object",
      "required": ["en"],
      "additionalProperties": {
        "type": "object",
        "required": ["title", "description"],
        "properties": {
          "title": { "type": "string", "minLength": 1 },
          "description": { "type": "string", "minLength": 1 }
        },
        "additionalProperties": false
      }
    },
    "tags": { "type": "array", "items": { "type": "string", "pattern": "^[a-z0-9-]+$" } }
  },
  "allOf": [
    {
      "if": { "properties": { "type": { "const": "submodule" } } },
      "then": {
        "properties": {
          "path": { "type": "string" },
          "url": { "type": "null" }
        }
      }
    },
    {
      "if": { "properties": { "type": { "const": "external" } } },
      "then": {
        "properties": {
          "url": { "type": "string" },
          "path": { "type": "null" }
        }
      }
    }
  ]
}
