{
  "slug": "wheel",
  "type": "submodule",
  "path": "/wheel/",
  "url": null,
  "repo": "https://github.com/SamWang8891/wheel",
  "icon": null,
  "i18n": {
    "en": { "title": "Spinning Wheel", "description": "Random pick wheel for decisions and giveaways." },
    "zh-Hant": { "title": "輪盤抽選", "description": "隨機決定、抽獎用的轉盤工具。" }
  },
  "tags": ["random", "decision", "wheel"]
}
